{
  "ts": "2026-09-21T16:28:43Z",
  "run_id": "weekday-2026-09-21",
  "alert_user": true,
  "sources": [
    {
      "name": "rad_oem",
      "status": "OK",
      "detail": "products.json HTTP 200; accessories 66 + spare-parts 65 = 131 unique; core-4 OOS unchanged + RadExpand Replacement Tire OOS; no sun-cover SKU; OEM External Battery Charge Port Cover in stock; GUB PRO-3 Phone Mount in stock"
    },
    {
      "name": "ebr_forum",
      "status": "STALE",
      "detail": "electricbikereview.com Rad forum RSS and /forums/rad-power-bikes.60/ both HTTP 404; Context mon_d85e4369 completed 2026-09-21T09:07Z no change \u2014 forum URL may have moved; Monday full crawl owns deepen"
    },
    {
      "name": "electric_bike_report",
      "status": "OK",
      "detail": "https://electricbikereport.com/feed/ HTTP 200; newest 2026-09-20 TWR Ep 101; Rad crowdfunding mention still in Ep 99 (Sep 6)"
    },
    {
      "name": "amazon",
      "status": "OK",
      "detail": "Via Context mon_7cfac79a: changes 2026-09-19/20/21 (chg_f46a5efb prior; new chg_c28a0138, chg_6a19a5f8). Direct scrape not repeated. Launch-queue extract monitors also Amazon-backed."
    },
    {
      "name": "etsy",
      "status": "OK",
      "detail": "openapi.etsy.com v3 OK with x-api-key keystring:shared_secret; display cover count=8, phone mount count=0, charge port cover count=1"
    },
    {
      "name": "makerworld",
      "status": "OK",
      "detail": "HTTP search pages 200; Rad-specific display-cover hits ~0 (printer/German Rad noise); generic e-bike charge-port caps present (Bosch/Yamaha/etc.); no reliable numeric API"
    },
    {
      "name": "x",
      "status": "BLOCKED",
      "detail": "Public x.com search returned error shell (Something went wrong / no tweet payload); no unofficial scrape"
    },
    {
      "name": "youtube",
      "status": "OK",
      "detail": "youtube_scan.py 7/7 searches OK; 31 signals emitted (1 dropped irrelevant); YOUTUBE_API_KEY from .env"
    },
    {
      "name": "context_rad_oem",
      "status": "OK",
      "detail": "mon_af59846a runs OK; change chg_36cc5f07 2026-09-19 Back Order\u2192Add to Cart; runs 2026-09-20/21 no further change. Not using deleted mon_35d2435d"
    },
    {
      "name": "context_ebr",
      "status": "OK",
      "detail": "mon_d85e4369 scheduled runs through 2026-09-21T09:07Z completed, change_detected=false"
    },
    {
      "name": "context_amazon",
      "status": "OK",
      "detail": "mon_7cfac79a changes on 2026-09-19/20/21; latest chg_6a19a5f8 at 2026-09-21T01:48Z"
    },
    {
      "name": "context_ebr_report",
      "status": "OK",
      "detail": "mon_d44aec3d last completed 2026-09-20T17:44Z no change; no Sep21 run yet at hunt time"
    },
    {
      "name": "context_sun_01",
      "status": "OK",
      "detail": "mon_c149fcde change chg_d537a5fb 2026-09-20 (display/sun cover shelf); scheduled 2026-09-21 run FAILED judge_failed (credits 0) \u2014 monitor flaky but prior change emitted"
    },
    {
      "name": "context_clasp",
      "status": "OK",
      "detail": "mon_885be9df changes 2026-09-19/20/21 (chg_9ba4008c, chg_bbd36ff5, chg_b6d67958) phone-mount competition churn"
    },
    {
      "name": "context_charge_cap",
      "status": "OK",
      "detail": "mon_4dada2b6 change chg_d64cd574 2026-09-19; scheduled 2026-09-20/21 runs FAILED judge_failed \u2014 emitted Sep19 change; flaky judge"
    },
    {
      "name": "facebook_manual",
      "status": "SKIPPED",
      "detail": "Weekly owns Facebook; not in weekday routine"
    },
    {
      "name": "reddit",
      "status": "SKIPPED",
      "detail": "Retired \u2014 do not scrape"
    }
  ]
}
